"job_title","company","location","job_summary"
"Consultant - Financial Services","NextGen Strategic Advisors","New York, NY","NextGen Strategic Advisors OverviewNextGen SA is a management consulting firm specializing in defining and implementing solutions for the Financial Services Industry. NextGen SA Partners have extensive experience and expertise working in Financial Institutions at senior management levels and working with Financial Institutions as management consultants. NextGen SAs practice areas include: Strategic Advisory, Risk Management Advisory, Regulatory Advisory, IT and Front to Back Operations Efficiency Improvement.NextGen Strategic Advisors is uniquely positioned to provide thought leadership in the evolving regulatory environment to assist our clients improve profitability and increase shareholder value.The NextGen SA AdvantageThe NextGen SA advantage is that the Consultant will work directly with Partners that have extensive Financial Services Industry experience. The Consultant will learn from experienced senior managers and will develop advanced consulting skills much more rapidly than in the large consulting firm environment.Consultant Job DescriptionThe Consultant will work very closely with our Partners to assist clients implement evolving Dodd-Frank and other industry regulations, develop business unit profitability analyses and develop strategies. The Consultant will work with our team to provide solutions for our clients across a broad range of complex issues.Position RequirementsThe Consultant we are looking for is a highly talented individual with a desire to learn, perform cutting-edge work and to have an excellent experience:Consultant RequirementsExcellent Powerpoint and Excel SkillsStrong Ability to CommunicateUndergraduate Degree1+ Years of Related Financial Services Industry Consulting Experience a plusCompensationHighly Paid: Consultant Compensation Will Be Commensurate with Experience and IndustryJob Type: Full-timeRequired education:Undergraduate DegreeRequired experience:Excellent Powerpoint, Word and Excel experienceJob Type: Full-timeRequired education:Bachelor'sRequired experience:Powerpoint and Excel: 1 year"
"Office Manager/Administrative Assistant","Therapeutic Learning Consultants, Inc","Mountain View, CA 94043","Behavioral Health-Office Manager (mountain view)Therapeutic Learning Consultants Inc., (TLC) provides behavioral health services to children with disabilities throughout the San Francisco Bay Area. Join a team that is driven by excellence and integrity to improve the quality of life for individuals at all levels of functioning.We are seeking a highly organized customer service oriented professional who has experience in Office Management and Scheduling responsibilities.Office Manager ResponsibilitiesWorks at our main office in Mountain View providing the primary administrative support to the agency.Job FunctionsProvides administrative and general clerical support.Provides support in preparing documents for payroll processing.Maintains and orders office supplies for the organization.Answers incoming phone calls using a multi-line phone system and direct calls to appropriate staff.Checks voicemail system on a daily basis.Maintains general administrative files.Creates and maintains client and staff calendars/schedules/files.Distributes and coordinates mail deliveries and pick-ups.Manage and coordinate schedules of staff and clientele on a daily basisNotify clients and staff of any last minute scheduling changes.Answer service inquiries in a professional mannerSchedule interviews and meetings.Become familiar with and understand company policies and procedures.Maintains confidentiality with staff and client informationQualifications and Experience:Must have at least an associate's degree from an accredited school (Bachelors degree preferred) in Business Administration, Human Resources or related experience is desired.Experience in a general administrative support position with public contact, office management, customer service or related field.Punctual and maintain a consistent schedule.Able to maintain a professional relationship with clients and staff.Computer proficient in Microsoft office word processing, database, spreadsheet and internet software programs and Google applications.Must take initiative, prioritize and accurately perform multiple tasks, and meet deadlines and changing priorities.Able to consistently demonstrate good judgment and decision-making skills.Able to exercise confidentiality and discretion pertaining to the work environment.Able to appropriately interpret and apply policies and procedures.Able to professionally and effectively interact and communicate, verbal and in writing, with volunteers, staff, and clients.Benefits for Full Time EmployeesCompetitive Pay * Medical, Dental, Vision, Voluntary LifePaid Time OffPaid HolidaysPlease send resumes to: jobs @tlcpractices.com (subject line: Office Manager)For more information about our company, please visit us at: www.tlcpractices.comJob Type: Full-timeJob Location:Mountain View, CARequired education:Bachelor'sRequired experience:Office Management: 1 yearScheduling: 1 yearGoogle Calendar: 1 yearSupervisor: 1 yearCalendar Management: 1 yearGoogle Docs: 1 yearRequired license or certification:Driver's License"
"RECRUITMENT CONSULTANTS - Life Sciences/Pharmaceuticals","CPL Physicians","Boston, MA","RECRUITMENT CONSULTANTS - Life Sciences/PharmaceuticalsBoston, Massachusetts, U.S.Our Company: CPL Physicians is part of a long established, award winning and leading International Life Science staffing business offering a variety of services for both candidates and clients. Under our specialist recruitment brands we offer innovative, diverse solutions and added value services as well as traditional staffing expertise to a long and exhaustive list of global Pharmaceutical and Life Sciences companies worldwide. After experiencing continual, year on year growth we are now expanding our recruitment operations globally and are seeking talented individuals to build our presence in the United States, specifically with the growth of our U.S. operation based in Boston.The Opportunity: You will be joining a growing international business dedicated to providing highly qualified specialist medical and clinical development staff to the pharmaceutical industry. As such we deal with highly sought after individuals and you will quickly pick up established client relationships and dealing with long standing preferred supplier agreements.We are a professional and consultative firm and it is essential to us that our consultants are positive brand ambassadors who believe in client partnerships and in providing high quality career advice to our candidates.The successful applicants will be rewarded with a generous basic salary, attractive bonus terms as well as a great benefits package. In addition our corporate business genuinely offers a defined career path which will include business management, the opportunity to travel if desired, client partnerships.We are a great staffing business but also offer an innovative range of services to our clients and candidates which give you many different options for a varied career.We are looking for strong Recruitment Consultants but also individuals who can build and lead teams.What we are looking for: It is vitally important that we secure the right individuals to help develop our business therefore we are seeking applications from individuals who possess the following:Successful 360 degree recruitment experience gained within a professional, consultative environment.A degree level education (a Life sciences or related degree, or an interest in the subject would be advantageous)Proven ability in building relationships with both clients and senior candidates within your field of specialism.A consultative, professional, and corporate approach to the recruitment process, able to thrive in a team and achievement focussed environment.Drive, ambition and tenacity to get resultsLooking to build a long term career in staffing and recruitment in a specialist sectorWe are proud of our business and very confident in the growth of our US operation and would like to hear from commercially minded individuals who are looking to build a career. We have an amazing company culture which is professional, innovative and offers exciting opportunitiesIf you are keen to explore this opportunity in greater detail please forward a full CV and covering letter to our Associate Director of Talent and Development, Jim MaddisonWe are looking to conduct formal, face to face interviews in early March 2017 therefore all candidates who are invited to this stage of the process will need to make themselves available for interview at this time, exact dates to be clarified in due course.Job Type: Full-timeRequired education:Bachelor's"
"Want to get out what you put in?","Colonial VW of Medford","Medford, MA","Automotive Professional - Volkswagen (Medford)We are looking to expand our sales team. Motivated individuals are currently being considered to join our Volkswagen of Medford team. We offer the most comprehensive training in our industry. Our success has been built upon Employee Satisfaction, Customer satisfaction and profitability. We are currently New England's #1 volume VW dealer. You would be working in our brand new, state of the art facility and using cutting edge technologies. Our reputation for customer satisfaction and loyalty is impeccable, this is the primary reason for our success. We are not your typical car dealership we take care of our customers and everything else falls into place. If you would be interested in joining our talented team of sales consultants working in a fast paced, professional and fun environment get in touch with us quickly. We are offering the right candidates a great opportunity to succeed in the automotive industry. If you have a strong work ethic, excellent customer skills and ambition this candidate could be you. Auto sales experience helpful but certainly not required of the right candidate.Qualifications: - Successful candidates will possess reasonable verbal communication skills and be highly organized. - College degree or equivalent combination of experience and education with experience working with the public. - Computer proficiency. - Ability to effectively present information and respond to questions from managers, clients, customers, and the general public. - Must be able to work weekends, evenings, and have a hunger to learn and earn.- Valid driver's license.Benefits include: Fantastic Earning Potential, Paid Vacation Health & Dental Insurance 401(k)This is not the Car Business of the past. Fax Resume to 781-391-3506Job Type: Full-timeSalary: $70,000.00 /yearJob Location:Medford, MARequired education:High school or equivalentRequired license or certification:DRIVERS LICENSE"
"VP Implementation Consultant EDM Data Warehouse Portfolio Fund accounting","DTS Markit","New York, NY","Ideal Experience to have: Must have strong data modeling expertise and good understand of databasesMust know portfolio/fund accounting financial dataMust be able to write specifications and map data to a defined data model (our standard)Past experience with PORTIA, Eagle PACE, etcPosition summary: An Implementation Consultant is responsible for providing a range of services to deliver the EDM product suite through consultation with internal and external clients.A good mix of technical competency, business/data expertise and project management skills are required.While the employee will be based out of the New York office, the role will be one that is on-site with clients Monday through Friday thus involving travel within the NA region.Projects can last between three to six months on average.Duties & accountabilitiesParticipates in pre-sales activity including product demos, POCs, workshops, discovery sessions and RFP activities.Provides consulting services to customers including the ability to understand challenges/requirements, provide recommendations, define implementation proposal and execute the delivery.Serves as project manager (or partner with) to establish work plans, manage issues/risks and track progress against budget.Develops specifications (BRD/FSD/TSD) to define interfaces, validations, rules, mappings, workflows, permissions, system controls and performance criteria.Configures the products per specification providing including building the interfaces, validations, rules, mappings, workflows and permissions.Document, analyses and map the different data feeds that populate/retrieve data to/from the IHS Markit EDM product suite.Participates in the testing process for new product versions and client testing cycles (unit, integration, UAT, parallel, etc.) during implementation to ensure deliverables are aligned with requirements and performant.Support the release management process and job automation proceduresLeads project handover meetings to ensure IHS Markit EDM Support and Client Management teams have a thorough understanding of the implementation.Supports the procurement of the infrastructure and installation of software at client site or in hosted environment.Partners with Sales and Client Management to identify new opportunities to extend usage of the IHS Markit EDM product suite.Provides input into the training curriculum and conducts training internally/externally.Provides input into the product roadmap by recommending new enhancements.Assist in the investigation and resolution of issues raised through the support.Supports strategic developments across the industry with particular reference to existing products.Department overview: The IHS Markit Enterprise Data Management (EDM) platform puts quality, audited data at the center of customers organizations.Its solutions build gold copy masters across all data types, delivering tangible data governance, risk management and compliance frameworks and rationalizing legacy architectures.The EDM Warehouse component provides customers with the option to leverage, a predefined enterprise data model as part of its deployment.The EDM Warehouse is packaged with a library of inbound data services that allows users to populate either the entire enterprise model or individual data sets.An outbound report services layer is available to expedite delivery of information to downstream applications.Job Type: Full-timeSalary: $144,000.00 /yearRequired experience:Implementing Enterprise Data Management (EDM) platforms: 1 yearportfolio/fund accounting: 1 year"
"Solar Sales Consultant for PV and Pool heating","ECS Solar Energy Systems","Gainesville, FL 32608","Experienced Sales Professionalswe have sales opportunities for professional business developers in North Central Florida.With financing options for our clients with zero down and low interest rates solar sells itself with payments that are about the same as the clients power bill. With a 30% Federal Solar Tax Credit for their investment. This means that the decision to go solar is an easy one to make since it does not disrupt their existing budget and they will save thousands of dollars in unnecessary utility costs by utilizing the sun's free energy. Applicants must have a clean background record, a valid driver's license, the ability to self-generate leads, set appointments, provide informative and compelling presentations, close sales, follow-up, and earn referrals. Compensation is commission based with bonuses if targets are met. A $100,000 + /year potential for high performance professionals. Only self-starting, motivated, goal oriented individuals need apply. Solar sales training provided.Job Type: Full-timeRequired education:High school or equivalent, AA or BS preferredRequired experience:Sales: 2 years outside/ in-home sales experience minimumFinancingJob Type: Full-timeJob Location:Gainesville, FLRequired education:High school or equivalentRequired experience:Outside/in-home: 2 yearsSales: 2 yearsJob Type: CommissionSalary: $120,000.00 /yearJob Location:Gainesville, FLRequired education:High school or equivalentRequired experience:Sales Financing: 1 yearSales: in-home: 2 yearsRequired license or certification:Driver's License"
"Account Consultant","Lombardi & Associates","Quakertown, PA 18951","Job Description-Account Consultant/AdministratorCoordinate Requests for Proposals from all companies and identify opportunities for cross selling. Includes preparing quotes, spreadsheets, all necessary presentation material for new prospect meetings, primarily for group, life & disability as requested, utilizing insurance company websites and company brochures.Prepare all necessary paperwork, research enrollment and deadline rules and company appointments for all new plan installations.Process through to installation all new business and follow up using Salesforce tasks.Utilize Salesforce to provide tracking reports on all new business applications in progress, client renewals and commission tracking.Ensure all new clients are entered into Salesforce and all renewals are updated.Obtain group renewal offers from Insurance Company websites and prepare additional quotes both from current insurance company and competitive quotes/plans when needed. This includes preparing spreadsheets comparing plan benefits and premiums to satisfy clients needs. Install and follow up on all necessary paperwork and outstanding issues.Offer Superior customer service to all clients and potential clients by handling incoming phone calls in a timely, professional and courteous manner which includes dealing directly with the insurance companies making inquiries concerning claims, billing, participating providers and processing all additions, deletes and changes for our group insurance clients. Follow-up to assure accuracy.Prepare for all upcoming meetings including quotes, information, all necessary paperwork for presentation.Collect and keep updated Insurance Industry changes, guidelines and rulesDevelop and maintain the Training Manual and Knowledge Library with current information to be used for future reference and new hires.The candidate must be detail-oriented, able to work independently, have excellent problem solving and communication skills.QualificationsApplicant must sign an Employee Confidentiality, Non-Competition and Non-Solicitation AgreementApplicant must provide an Application for Employment, including fingerprinting and Criminal Background CheckBA/BS preferred but not required2  5 years insurance experience in group health insurance preferredPA State Insurance Broker License for Life, Accident & Health Insurance is required. If not licensed will support the right candidate to get a license within 60 days of date of hire.Job Type: Full-timeRequired education:Bachelor'sRequired experience:insurance: 2 yearsRequired license or certification:PA Life, Accident, Health Licensed"
"EXPERIENCED B2B Oustide Professional Sales Consultant - Corporate Direct","CardConnectDirect","Springfield, MO","EXPERIENCED OUTSIDE BUSINESS TO BUSINESS SALES PROFESSIONALContractor to Salary W2 with BenefitsWe are seeking an experienced and highly motivated business to business sales professional that has perfected the consultative sales approach.If you can face-to-face prospect multiple business locations daily, communicate with a support staff to ensure your sales & financial success and assume the sale because youre just that good, please continue reading.CardConnectDirect ( Nasdaq: CCN )With a distinct vision to serve and provide our customers with the most innovative and efficient products and services available all while upholding the highest level of integrity, CardConnectDirect has been identified as a leader in the merchant service industry. In 2013, 2014, 2015 and most recently in 2016, Inc. 500/5000 has recognized CardConnectDirect as one of the fastest-growing private companies in America surpassing 2,573% growth in just four years.Today, the CardConnectDirect team is dedicated to fulfilling the service needs of over 65,000 business operations nationwide by providing secure credit transaction processing solutions. We are an industry leader in the development and distribution of point-to-point encryption technology, protecting our customers from todays cyber criminals while increasing sales ratios, profitability and consumer spending and reducing losses and liabilities, ensuring long-term customer retention. Member of the Electronic Transactions Association (ETA) A+ rating with the Better Business Bureau Senior Management are inaugural holders of the Certified Payments Professionals certification CardConnectDirect possesses over 75 years of senior management combined industry experience. We are seeking experienced, competitive and motivated Outside Sales Representatives to close sales of our business solutions with merchants throughout the area. You will work closely with our corporate office to set appointments with business owners using face-to-face prospecting, networking, and referral partner relationships. You will then run scheduled appointments, uncover needs and present CardConnect solutions to close sales. You will work primarily from a home office as you enjoy the best compensation and benefits plan in the payment processing industry.Sales Executive Responsibilities: Job Description:  Develop and maintain an ever growing pipeline with a minimum of 8 new appointments weekly Educate prospective clients on new secure and safe processing options Meet and exceed defined weekly/monthly sales quotas Utilize current experience and contacts for networking and expansion of client base Assist with merchant implementation Maintain productive relationships with client base Work under minimum supervision Good math and problem solving skillsMinimum Requirements:  3 years outside business to business or enterprise sales Bachelors degree preferred Must have a PC or MAC iPad (one will be provided upon transition from 1099 to W2) Must have high speed internet and cellphone Scanner or Fax to send application to our corporate office Automobile with insurance Submit to a background check that may include criminal, education, employment and drug testingCardConnectDirect offers an attractive compensation package including:  Long term stability with ongoing monthly increases in residual compensation. W2 w/Salary, commission & residual offered after successful 60-90 day sales probationary period. Car / Phone allowance offered after successful 60-90 day sales probationary period. Medical, Dental, Vision & Health Insurance paid at 50% for entire family as a W2 employee. iPad Pro with digital presentation provided to W2 employees Sales executives can expect to earn $85k-$135K first year including bonuses and weekly incentives. Seasoned merchant service sales representatives can expect to earn $125k-$150k+ first year including bonuses. Business cards/brochures/marketing materials all provided Recent Sales incentive trips (Hawaii, Puerto Rico, and Las Vegas)All resumes held in confidence. CardConnect does not discriminate against employees or applicants for employment based upon race, color, national origin, genetic information, religious beliefs, gender, sexual orientation, age, marital status, disability, U.S. veteran status, or any other protected classifications, activities, or conditions as required by federal, state and local laws.Copyright  2017, CardConnectDirect All rights reserved. www.cardconnectdirect.comJob Type: Full-timeRequired education:High school or equivalentRequired experience:B2B Outside Sales Prospecting: 3 yearsB2B Consultative Sales: 3 yearsB2B Outside Sales: 3 yearsRequired license or certification:Driver's License"
