"job_title","company","location","job_summary"
"Behavioral Health Care Manager","IHA","Ann Arbor, MI","POSITION DESCRIPTION: The Behavioral Health Care Manager (BHCM) is an integral member of the Collaborative Care team that involves the patient's primary care provider, a psychiatric consultant, and, when available, other mental health providers. Essential responsibilities for this role include coordinating and supporting mental health care within the clinic and for coordinating referrals to clinically-indicated services outside the clinic. The care manager may provide evidence-based treatments or work with other mental health providers when such treatment is indicated.The Behavioral Health Care Manager will offer diagnostic assessment and symptom monitoring, and care management surrounding behavioral health. Care management involves use of psychoeducation and monitoring, provision of patient education tools, brief face-to-face interventions in primary care clinics when warranted, and collaboration with primary care clinicians to ensure appropriate support and management of mental health symptoms. The position does not include providing long-term therapy.ESSENTIAL JOB FUNCTIONS: Support and closely coordinate mental health care with the patient's primary care provider and, when appropriate, other treating mental health providers.Screen and assess patients for common mental health and substance abuse disorders.Provide patient education about common mental health and substance abuse disorders and available treatment options.Monitor patients (in person or by telephone) for changes in clinical symptoms and treatment side effects or complications.Support psychotropic medication management prescribed by PCPs, focusing on treatment adherence, side effects and other complications, and effectiveness of treatment.Provide brief interventions using evidence-based techniques such as Behavioral Activation.Provide or facilitate in-clinic or outside referrals to evidence-based psychosocial treatments (e.g, CBT, IPT) as clinically indicated.Participate in regularly scheduled (usually weekly) caseload consultation with the psychiatric consultant and communicate resulting treatment recommendations to the patient's PCP. Consultations will focus on patients new to treatment or who are not improving as expected.Facilitate patient engagement and follow-up in care.Track patient follow-up and clinical outcomes using a registry. Document in-person and telephone encounters in the registry and use the system to identify and re-engage patients.Document patient progress and treatment recommendations in the registry so they can be easily shared with PCPs, the psychiatric consultant, and other treating providers.Facilitate treatment plan changes for patients who are not improving as expected in consultation with the PCP and the psychiatric consultant. These may include changes in medications or psychosocial treatments or appropriate referrals for additional services.Facilitate referrals for clinically indicated services outside the primary care clinic (e.g., social services such as housing assistance, vocational rehabilitation, mental health specialty care, substance abuse treatment).Complete relapse prevention plan with patients who are in remission.Assumes additional responsibilities and performs work within position licensure, as required.ORGANIZATIONAL EXPECTATIONS: Creates a positive, professional, service-oriented work environment for staff, patients and family members by supporting the IHA CARES mission and core values statement.Must be able to work effectively as a member of the Behavioral Health Care team.Successfully completes IHA's ""The Customer"" training and adheres to IHA's standard of promptly providing a high level of service and respect to internal or external customers.Maintains knowledge of and complies with IHA standards, policies and procedures, including IHA's Employee Handbook .Maintains complete knowledge of office services and in the use of all relevant office equipment, computer, and manual systems.Maintains strict patient and employee confidentiality in compliance with IHA and HIPAA guidelinesServes as a role model, by demonstrating exceptional ability and willingness to take on new and additional responsibilities. Embraces new ideas and respect cultural differences.Uses resources efficiently.Responsible for ongoing professional development  maintains appropriate licensure/certification and continuing education credentials, participates in available learning opportunities.Responsible for completing additional Healthstream requirements as assigned.MEASURED BY: Performance that meets or exceeds IHA CARES Values expectation as outlined in IHA Performance Review document, relative to position.ESSENTIAL QUALIFICATIONS: EDUCATION: Master's degree in social work from a school accredited by the Council of Social Work Education is necessary, or equivalent.CREDENTIALS/LICENSURE: Valid, unrestricted license to practice clinical social work in the State of Michigan or similar relevant licensure. Valid CPR certification.MINIMUM EXPERIENCE:Prior experience with screening for common mental health and/or substance use disorders.Experience with assessment and treatment planning for common mental health and/or substance use disorders, when appropriate.Experience working with patients who have co-occurring mental health, substance abuse, and physical health problems.Experience with evidence-based counseling techniques (e.g. CBT or PST).POSITION REQUIREMENTS (ABILITIES & SKILLS): Knowledge of patient care procedures and organizational policies related to position responsibilities.Familiarity with brief, structured intervention techniques (e.g., Motivational Interviewing, Behavioral Activation)Basic knowledge of psychopharmacology for common mental health disorders.Ability to effectively engage patients in a therapeutic relationship.Proficient/knowledgeable in relevant medical terminology.Ability to perform mathematical calculations needed during the course of performing basic job duties.Proficient in operating a standard desktop and Windows-based computer system, including but not limited to, electronic medical records and other care management and/or clinical IS systems, email, e-learning, intranet, Microsoft Word and Excel, and computer navigation needed to complete the tasks of clinical care and performance reporting. Ability to use other software as required while performing the essential functions of the job.Excellent communication skills in both written and verbal forms, including proper phone etiquette. Ability to speak before groups of people.Ability to work collaboratively in a team-oriented environment; courteous and friendly demeanor.Ability to work effectively with various levels of organizational members and diverse populations including IHA staff, executive and management staff, providers, patients, family members, insurance carriers, vendors, external customers and community groups.Ability to cross-train in other areas of practice in order to achieve smooth flow of all operations.Good organizational and time management skills to effectively juggle multiple priorities and time constraints.Ability to exercise sound judgment and problem-solving skills.Ability to handle patient and organizational information in a confidential manner.Knowledge of the compliance and quality aspects of clinical care and patient privacy and best practices in medical office operations.Successful completion of IHA competency-based program within introductory and training period.MINIMUM PHYSICAL EXPECTATIONS: Physical activity that often requires keyboarding, phone work and charting.Physical activity that often requires extensive time working on a computer.Physical activity that often requires handling and lifting patients walking, standing, bending, stooping, reaching, climbing, kneeling and/or twisting.Physical activity that often requires lifting, pushing and/or pulling up to 20 pounds.Specific vision abilities required include close vision, depth perception, peripheral vision and the ability to adjust and focus.Manual dexterity sufficient to operate a keyboard, photocopier, telephone, calculator and other office equipment.Must hear and speak well enough to conduct business over the telephone or face to face for long periods of time in English.MINIMUM ENVIRONMENTAL EXPECTATIONS :This job operates in a medical facility and requires regular walking to various locations around the hospital/clinic. Employees will be working where there is patient care equipment. Hazardous materials, including bloodborne pathogens and bodily fluids are also present. Exposure to sharps, x-rays, patients' conditions and some unpleasant sights, smells and contagious diseases is possible. This position requires significant interaction with people (many of whom are scared, hurt and/or ill) which can be stressful and result in competing priorities.Job Type: Full-timeJob Location:Ann Arbor, MIRequired education:Master'sRequired experience:Clinical: 3 yearsRequired license or certification:LCSW"
"Environmental Specialist / Project Manager","Kynoch Environmental Management, Inc.","Chevy Chase, MD 20815","Shouldn't you have a job so fulfilling you'll want to stay there until you retire?Environmental Specialist / Project ManagerKynoch Environmental Management, Inc.Salary Range : $50,000 - $65,000 annual  salary commensurate with experienceLocation:  Chevy Chase, MDThe Company:  Kynoch Environmental Management, Inc. (KEM) is a small, rapidly growing environmental consulting firm providing value-engineered solutions to common environmental problems. KEMs work is concentrated in the areas of asbestos, lead-based paint, mold, and indoor air quality. Our clients include general contractors, property managers, and government agencies. The office is fun, fast-paced, and casual.The Position:  You will be working as a professional environmental consultant, managing environmental projects, from first client interface to project closeout. Projects include: Asbestos inspections and abatement monitoring, lead based paint inspections/risk assessments/abatement monitoring, mold inspections and remediation monitoring/clearance sampling, indoor air quality investigations and sampling, phase I environmental site assessments and more.Benefits: Health Insurance, Vision Insurance, Life Insurance, Disability Insurance and 401KProfessional education reimbursementPaid parking16 days of PTO, increasing one day each year to max of 26 daysPaid cell phoneRequirements: Environmental, engineering, industrial hygiene, or safety degree (Bachelors) is a MUST.3-5 years of experience MINIMUM in environmental consulting field, performing asbestos, lead-based paint, and mold inspections, indoor air quality investigations, Phase I environmental site assessments, LEED testing, etc.Asbestos Inspector, Project Designer Certification/Licenses (MD, VA)Lead Inspector, Risk Assessor Certification/Licenses (DC, MD, and VA)Ability to write technical reports is important, as they are the product of this businessSubmit a cover letter telling us your favorite ML Baseball team along with your resume.Job Type: Full-timeSalary: $65,000.00 /yearJob Location:Chevy Chase, MD 20815Required education:Bachelor'sRequired experience:IH, Environmental or Safety: 3 years"
"Behavior Specialist/Mobile Therapist","Family Behavioral Resources","Bedford, PA 15522","Now Hiring Licensed Behavior Specialist Consultants**Part-time & Full-time Hours AvailableJOB PURPOSE:  This position is responsible for providing direct and indirect behavioral intervention and consultation for consumers, family members, and other stakeholders. This position is responsible for guiding treatment by developing a treatment plan, monitoring progress on goals, intervening directly with a consumer, and developing programs, as appropriate.ESSENTIAL JOB FUNCTIONS: Leads and directs individualized treatmentProvides treatment of the whole personConsults with all members of the treatment team to ensure plan participationMonitors individualized consumer-drive data to address consumer needsSupervises response to emergency/crisis situations with team members and consumersParticipates in required meetings, evaluations, supervision and trainingsCompletes all required clinical documentationMaintains assigned, planned scheduleMaintains a commitment to professional developmentAdheres to professional and ethical interaction policies and proceduresSupports on-going and future business needsQUALIFICATIONS: Masters degree from an accredited college or university in Psychology, Social Work, Counseling, Education, or similar human services fieldProfessional licensure required (BSL, LSW, LPC, LCSW, LMFT)At least 1 year of experience in either a CASSP service system or employed by a licensed mental health services agency or subcontracted agency.*Employee Benefits include competitive wages, paid travel, paid training and supervision, healthcare coverage, vacation and sick time, and personal growth opportunities.Job Type: Full-timeRequired education:Master'sRequired license or certification:BSL, LSW, LPC, LCSW, or LMFT"
"Service Sales Consultant","ACF, Inc.","Melbourne, FL","Indeed Hire has partnered with ACF, Inc. to find a Service Sales Consultant position for their sales team.Job DescriptionThe purpose of the Service Sales Consultant position is to increase aftermarket parts and service business and to generate new equipment leads within the sales department. The SSC will promote the Company service and parts departments to increase sales in PM agreements, equipment repairs, rental equipment, fuel tank remediation and generally promote ACF Standby Systems as the primary source for aftermarket parts and service of power generation equipment.Essential Job FunctionsDevelop sales proposals of generator products for customers and professionally present proposals to plant engineers, maintenance personnel, purchasing agents, and/or company executivesDevelop Aftermarket program proposals for the air compressor service department for customers and professionally present proposals to plant engineers, maintenance personnel, purchasing agents, and/or company executivesResearch and evaluate customer application in order to properly size and/or develop an aftermarket recommendation that meets the customers needsConduct air system surveysEnsure the establishment of industry contacts and develop a list of potential customersFollow up on sales leads and make cold callsMaintain updated understanding of industry trends, technical developments, and government regulations that effect target marketsProactively take action to close sales and finalize contractsMeet established sales quotas and revenue goalsResolve customers problems with product and/or servicesFollow up on product deliveriesMonitor and work within established expense allowanceGenerate detailed scope of supply (PMU) and provide to Application Engineer or Service Manager for processingDevelop sales proposals of generator products for customers and professionally present proposals to plant engineers, maintenance personnel, purchasing agents, and/or company executivesAdditional Job FunctionsEstablish and maintain a sub-dealer network within geographic territory, including training the sub-dealer and assisting them with the financial aspect of the businessCollect payment and financial documents from customersEstablish and maintain a teamwork approach in the area of aftermarket products and service departments in order to develop and maintain customer loyaltyRequired Knowledge, Skills and Abilities (including physical and work environment)Well-developed sales and presentation skillsComputer literacy is required, including a working knowledge of applications such as Outlook, Word, PowerPoint, and ExcelBasic mechanical and technical aptitude including geometric and other mathematical formulasExcellent oral and written communication skillsAbility to establish a solid relationship with manufacturerProven interpersonal skills with both internal and external customersBasic marketing knowledgeMust be able to handle high-pressure situations and adapt well to changes in the marketMinimum Job Qualifications (education, work experience, licenses/certifications)Associates degree or 2 to 5 years of sales experience (industrial sales preferred), or an equivalent combination of education and experienceJob Type: Full-timeRequired experience:sales: 2 yearsIndustrial Sales: 2 yearsOutside Sales: 2 yearsSelling commercial generators: 2 years"
"Bilingual Insurance/Financial Sales Professional's (Spanish/Portuguese)","New York Life- Manhattan, NY General Office","New York, NY","Job DescriptionNew York Life is seeking Bilingual Spanish and/or Portuguese professionals who want to build an insurance & financial business with the potential to earn a significant income, set their own pace and maintain a flexible schedule. Dedicated to serving the Latino community, we are looking for people fluent in English, Spanish, or Portuguese with a great drive to succeed, the passion to make a difference and the desire to love what they do.We are looking for people who possess the following background/characteristics:*Four-year college degree, or higher, preferred but not necessary.*Portuguese and/or Spanish speaking preferred, but not necessary.*Entrepreneurial Spirit.*Life and Health Insurance License preferred, but not required*Previous Sales Experience preferred*Financial Industry background not required*Highly self-motivated and self-disciplined with ability to work effectively with little or no supervision.*Outgoing personality with the ability to develop relationships*Fearless, positive attitude and willingness to be accountable for results.*Organized, detail-oriented, and excellent time-management skills*Desire for continuous learning.*Good communicator with excellent listening skills and ability to explain complex information in a simple and concise manner. If you've never considered a career in insurance and financial sales, that's okay! Our Financial Professionals arrive with diverse career backgrounds including education, coaching, athletics, military, finance, banking, mortgage, and real estate. We provide the training, the resources and the specialized marketing support to help you establish your business and stand behind your efforts. New York Life's family of companies offers life insurance, retirement income, investments and long-term care insurance and annuities. Training - NYLIC University is one of the most comprehensive and well-respected training programs in the industry.Our nationwide team consists of leaders in insurance, investments, estate, family and business planning. In addition to sales aptitude or experience, the ideal candidate should be community-minded, have a competitive spirit, and possess excellent communication skills, as well as outstanding character and integrity. Here is what distinguishes this opportunity with New York Life: Career Advancement - After two years as a successful agent, additional opportunities that may be available include: partner, development manager, product consultant, and Home Office opportunities in recruiting, marketing, or training.Our Financial Services Professionals help clients identify and achieve their financial goals. In addition to quality life insurance and products for retirement, registered representatives can offer an array of financial products and services to help clients develop a sound, long-term investment strategy.Benefits IncludeWe offer a comprehensive benefits package that includes: Health/Dental/Life/Disability from day one401(k) plan after one year of serviceDefined Benefits Pension Plan (Subject to eligibility and vesting requirements)Tuition reimbursement for courses taken to expand industry credentialsReimbursement for certain Company approved industry designationsDiscounts from major wireless carriers Take the first step to your future success and by becoming a part of The Company You Keep EOE M/F/D/VLocal discounts (based on location) for gym memberships**Participation in many local provider discounts available, depending on location and services. At New York Life we strive to be the best every day, the same as you. Here are just a few of our recent recognitions: Ranks #50 on the Fortune 500 list for 2016**.**Based on revenues as reported by Fortune 500 ranked within Industries, Insurance: Life, Health (Mutual), Fortune magazine, June 16, 2016.D/VJob Type: Full-timeJob Location:New York, NYRequired languages:PortugueseSpanish"
"Solar Consultant","Apex Solar","Freehold, NJ","JOB DESCRIPTIONAttention all Outside Sales Reps and Lead Generators! We have the best compensation plan in the industry.Become part of the Solar industry with Apex Solar, a company that gives the best value to its customers. We are a full service solar company that provides renewable solar energy in both residential and commercial sectors. We have the best programs in the industry.We have a tree service divisionWe have a roofing divisionOur prices are the lowest in the solar industryWe pay full commissions within 2 weeks of signed agreement of any solar deal. We pay .25 cents a watt on all jobs,YES! Average payout per sale is $1100.00 - $2500.00We are expanding our territory in Central, Northern and Southern New Jersey limited positions available.Bachelor's Degree desired but not necessary.1 yr sales experience a must.Preferably specialized in Marketing/Business Development or equivalent.Must be computer literate and able to navigate the web.Organizational skills a plus, organizing sales pipeline.Relationship Building a must..Listening to customer requirements and presenting appropriately to make a sale.Maintaining and developing relationships with existing customers in person and via telephone calls and emails.Cold calling to arrange meetings with potential customers.Road warriorSimple unique sales process zero selling technique relationship and value driven sales.Training classes provided prior to start date.NJ Drivers license required.Free trainingMain responsibility will be driving D2D residential sales consultations.We will welcome you into an organization full of experience and ambition while providing you with exciting challenges and growth opportunities.Compensation: 60k - 110k depending on sales experience.Email Resumes: chris.ibe at apexsolarnj.comJob Type: Full-timeSalary: $70,000.00 to $100,000.00 /yearRequired education:High school or equivalentRequired experience:sales: 1 yearRequired license or certification:Driver's License"
"Consultant | Microsoft Dynamics NAV","Stoneridge Software","Minneapolis-Saint Paul, MN","Stoneridge Software seeks a sharp, personable and highly motivated individual to join our growing Microsoft Dynamics NAV Enterprise Resource Planning (ERP) implementation team as a Functional Consultant.Our consultants work directly with our clients as business analysts and technical experts. Their purpose is to determine system requirements that will meet clients business objectives. This process includes identifying gaps between existing functionality and those requirements, working closely with our internal project team to develop customizations to fill those gaps, training, and ultimately deploying Dynamics NAV.Responsibilities: Ensure client satisfaction at all timesFacilitate the successful implementation of Dynamics NAV using Stoneridge best practicesWork with clients to understand their business requirements and conduct gap analysisConvert client requirements to functional specs and design documentsDesign, configure and test core Dynamics NAV modulesProvide post-implementation support as neededCommunicate effectively in all mediums and to all levels within the organizationPractice the Stoneridge Software implementation methodologySet aside time for self-development by attending training or self-learning on key subjectsRequirements/Qualifications: Bachelors degree in Business, Accounting, Information Technology or related field2+ years ERP experience, preferably Microsoft Dynamics or related product experience2+ years consulting experience in business-to-business environmentStrong technical aptitudeAbility to work directly with clients, individually or with a teamAbility to concurrently manage multiple projectsAbility to communicate effectively in both spoken and written EnglishAbility to travel to customer sites as requiredAbility to work collaboratively for the best interests of the business and the teamStoneridge Software provides our employees with the following benefits: Health InsuranceHealth Savings Account ContributionMedical and Dependent Care Flexible Savings AccountsDental InsuranceVision Insurance401(k) MatchLong-Term DisabilityLife InsurancePersonal Mobile Phone AllowanceHome Internet AllowancePTO and Company Paid HolidaysFlexible Work EnvironmentStoneridge Software is an Equal Opportunity Employer. Employment decisions are based on business needs, job requirements, and individual qualifications.Job Type: Full-timeJob Location:Minneapolis-Saint Paul, MNRequired education:Bachelor'sRequired experience:ERP: 2 years"
