"job_title","company","location","job_summary"
"Senior Consultant","The Claro Group","Chicago, IL","Company DescriptionThe Claro Group, LLC is a financial, economic and management consulting firm. As one of the few privately-owned consultancies, we remain uniquely focused on our clients and our people, while providing creative solutions with innovative pricing models where appropriate. The industry is a complicated, ever-changing, and demanding industry. The client needs are diverse and complex.The DCI practice offers deep experience working on behalf of our clients to evaluate and quantify complex commercial claims in litigation and for insurance recoveries, conduct forensic investigations, and assist in valuation assignments ranging from business entities to intellectual property. Our consultants work closely with seasoned financial experts to analyze impacts and provide independent expertise and testimony. This position is based in our Chicago, IL office, with some travel as needed.Duties and Responsibilities: Assist in the management of various engagement objectives and day-to-day tasksPerforms technical, industry, and company research utilizing online tools and publicly available information, develops work plans and executes analyses to assess complex questions of fact, assists in preparing reports and schedules summarizing findings that will be delivered to clients and other parties.Provide quality control for junior members of the team.Applies accounting, financial, valuation, and analytical skills to various client situations and practice disciplines, such as detailed reviews of financial statements and underlying accounting records, preparation of complex cash flow projections, and preparation of worksheets to model business processes.Organizes information to facilitate effective data access and analysis.Supervises more junior team members analyses.Prepare and present written analyses, reports and presentations to clients.Ensure timely completion of project deliverables while maintaining a high quality of product.Present project deliverables and findings to senior team members as required.Manage risks and utilize creative problem solving techniques.Mentor junior members of the team.Qualifications: Four year degree at a college or university in Economics, Finance, Accounting or related degree.Three or more years of experience in forensic accounting, financial analysis, auditing or financial or management consultant.Demonstrated ability to apply analytical and logical thinking while solving business needs and presenting solutions.Experience and demonstrated skill organizing and presenting complex information effectivelyExcellent written, oral communication and presentation skills.Demonstrated ability to work both independently and as an integral member of a team.Strong organizational skills and the ability to work on multiple, complex projects in diverse areas.Experience in financial analysis and working with data inputs from multiple sources .Experience with developing models using Microsoft Excel, PowerPoint, Access, Visual Basic, or other tools (Tableau).Job Type: Full-time"
"Home Improvement Sales Project Consultant","A+ Construction Pro","Fremont, CA","Home Improvement Sales Project ConsultantAmerican Construction Pro - Bay Area, CA75,000-120,000 a yearW2, Base salary + uncapped commission, car allowance!American Construction Pro is a General Contracting company serving Bay Area with business in new construction, additions and house remodel, as well as kitchen and bathroom remodeling.We are looking for experienced Sales Project Consultant with a strong sales background and knowledge in home improvement and remodeling. In exchange for your experience and passion for closing more sales and making your clients happy we are glad to offer a W-2 position with base salary + uncapped commission and car allowance.No cold calling/canvassing - all appointments providedNo cap on commission - no limitNo fear of how to pay your bills on time during your start period - base salary providedNo more hassle with self-employment tax - you are W-2 employeeNo more unpaid mileage - we provide car allowancePlease do not apply if youdon't have experience in remodeling/home improvement salesdon't know how to use CRM and basic computer programs (or not ready to learn it fast)can't make accurate measurements and basic drawingsaren't ready to drive long distances to clients home across all Bay AreaRequirementsPosition requires extensive local market area travel with the use of a personal vehicle to travel to appointments.Must have valid driver's license and carry required level of automobile insurance.Must be computer proficient - e-mail, Microsoft or Google Office suite, CRM, special remodeling/home improvement software.Must have the ability to work a 6-day workweek, which includes Saturdays. Additional days may be required based on volume and seasonality, in addition to the flexibility to work afternoon, evening and weekend hours.Ability to negotiate contracts and communicate effectively both verbally and in writing.Proven ability to make measurements, basic drawings and produce shopping lists for clients (cabinets, kitchens, windows, tile, trim, hardware, fixtures, etc.).Candidate must have excellent customer service, listening and influencing skills and have a passion for improving the lives of our customers.Please apply with your resume clearly showing you are a good fit for us and include a list of references.Required experience: Home improvement/remodeling sales - 2 yrCA Drivers Licensewww.a-plus-construction.comwww.facebook.com/aplusconstructionpro44250 Old Warm Springs Blvd,Fremont, CA94538Job Type: Full-timeSalary: $120,000.00 /year"
"Sales Consultant, $130k at plan (Home Improvement/Construction)","Renewal by Andersen of Portland & Eugene","Portland, OR","Job DescriptionRenewal by Andersen, the window replacement and installation experts, are seeking talented sales consultants to represent the Andersen brand of quality and service; build trust and rapport with our customers quickly; and have a drive and motivation for top results. We look for talented individuals who value a company focused on the customer. We are seeking to expand out team in the Portland and Eugene, Oregon and continue our success through the upcoming year!Lead GenerationUnlike other sales opportunities, Renewal by Andersen utilizes traditional and non-traditional marketing to provide out sales representatives with leads. This means NO COLD CALLING or prospecting for our sales representatives. The leads we provide are pre-qualified and pre-confirmed before you visit our customers homes.Compensation & BenefitsPay for performance is a salespersons greatest compensation motivator! Our compensation plans rewards solid performance with a strong commission rate and the opportunity for performance bonuses. At plan you will earn $130,000.000. Median income for our in-home consultants is $120,000.00 to $200,000.000. In addition, we offer a full complement of employee benefits including health, dental, vision, life, 401k, and more!Learning, Development & CultureWe offer two weeks of paid training to ensure you are successful in this role. The first two weeks are spent in the classroom and in the field. Our Sales Managers coach new reps on the extensive products we offer along with a proven sales methodology. The ongoing coaching and training will build the skills and confidence you want in order to get the results you strive for!Renewals culture is vastly different from other companies. We promote our employees happiness in all areas of their lives. We know that happiness and positivity drive business results and we are dedicated to making sure your wellness comes first. We encourage collaboration amongst the sales team, growth within the role, and innovation as an organization*To see a day in the life of one of Renewal's sales consultant check out our videohttps://www.youtube.com/watch?v=ZP0yFOv_SX8Job RequirementsDesired Skills and Experience5+ years of success being a top producer in an outside sales environment, plus,2+ yrs. of Home improvement sales, in-home sales experience, or experience being a top performer employing a one call close is required. Our typical salesperson has years of experience, and folks from all sorts of industries and of all ages have found this to be the best sales job theyve ever had.A proven track record of closing sales.A strong focus on exceeding customer expectations.Schedule availability to run homeowner appointments on many evenings and weekends.Strong written and verbal communication skills.Self-motivation and results orientation.Time and work process management skills with the ability to work independently.College degree or an equivalent combination of education and experience.Valid drivers license with a clean driving recordThanks for your interest but only fully qualified candidates will be contacted.Job Type: Full-time"
"Entry Level Recruiter (Attention recent college grads)","Eliassen Group","Wakefield, MA","Overview:  Given the opportunity you will participate in our elite 3 month hands-on training program. We offer you all the building blocks to become a successful recruiter, including; calling candidates about career opportunities, matching candidates with open positions, and filling job needs for one of our clients. The top performers in the recruiting field learn not only from an outstanding training program, but from the tenured and successful people that surround them. We invite you to join our successful team and learn from the BEST in the industry. We pride ourselves with recognition and promoting from withinthat can be YOU !!What it looks like today: Start with a cohort of successful college graduates in an elite training program designed to graduate superstarsWork with expert recruiters and sales people to learn high-impact communication strategiesBe recognized by our leadersFuture Outlook: Opportunity for six figure incomeYour merit, success, and drive provide the framework to grow into a leadership position with the chance to build your own teamThe chance to create your own career path (recruiting, sales, management, etc.)Key Tasks & Responsibilities: Responsible for making connections and developing relationships with IT professionals who may be a good fit for assignment with Eliassen Groups clients.Attend networking fairs and network through sites like LinkedIn, Monster, Dice, etc.Build a pipeline of candidates for skill sets that are needed repeatedly for client assignments within the branch.Update existing candidate profiles with more current information.Develop recruiting strategies.Requirements: Bachelor's degree requiredHigh energy with an aptitude to learn new technology.Ideal candidate would have experience working with a staffing or consulting company.Must possess exceptional communication and phone skills, a great personality, strong organization skills and a strong desire to succeed.Need good negotiation skills.Should have a high-level understanding of MS Office (Word, Excel, Outlook, etc.).Ability to work in a dynamic and fast paced environment.Any experience with Information Technology, recruiting, and/or account management is a plus.Company Overview Eliassen Group has been driving the success of our clients, consultants and employees within Technology Staffing and Consulting Services since 1989. For over 25 years, we have been staffing and consulting leaders, perfectly matching capable and talented people with successful companies, helping them to attain their business objectives.Job Type: Full-timeRequired education:Bachelor's"
"Senior Energy Consultant","Mission Energy Solutions Inc","San Diego, CA 92101","About the Company: Mission Energy Solutions is searching for a dynamic Senior Energy Consultant with strong presentation and closing skills to join our team. In this position, you will help open new markets and establish relationships that generate more sales and loyal customers. We will provide you with the training, support and excellent compensation program to help ensure you achieve in excess of six figures during your first year. Our new Multiplier Compensation Structure is changing the game putting the consultant in prime position to earn what they deserve. Come experience the Mission difference.In This Role, You Will: Develop a thorough understanding of the products and services that Mission Energy Solutions offers to our clients.Develop a network of partners who can refer you when opportunities arise.Educate prospects on what makes us different than our competitorsProspect by either telephone, live events, meetings, social media, and any other methods which result effective to help fill your pipeline.Work with senior management to set sales goals and objectives.Take prospects through the sales process, analyze needs, present solutions and close the presentation.Grab company warm-qualified leads and convert to sales.You Have: High-energy and are a positive minded person.Demonstrated ability to successfully prospect, develop and present proposals to clients.Strong understanding of strategic sales skills.Excellent verbal communication skills.Proven success in achieving and exceeding sales quota targets.Excellent organizational skills.Bilingual is a tremendous plus .Why Join Mission Energy Solutions?We are not only dedicated to helping families and businesses save money, increase home values and preserve the environment, were also committed to making a difference in peoples lives by connecting one solar panel at a time. With every solar panel placed, we support efforts to help underprivileged, at-risk, homeless and exploited youth locally and around the world.This is at the heart of why we exist and operate our business. With our mission driving us forward we believe that together, we can create better opportunities, education and valuable resources that will leave the world better than we found it. Together we can a make a difference.Compensation Plan: After the two closed deals at 8%, each consultant will be required to sell a minimum of ONE solar system per month to maintain this commission level. Our average system size is a 8.5 KW solar system at the medium commission rate. Let's take a look at what that would look like. If you, the consultant sold 2 jobs per month, at this high incentive program, you would make an average of $22,000 per month. $22,000 x 12 = $264,000. Let's say, you happen to develop systems to close 4 a month. (Some of our consultants close about 7 on average per month). 4 per month at (4 x $10,500) @ the medium is $42,000 per month or $500,000 per year.If you are interested in joining our team, please apply today for immediate consideration.Job Type: Full-timeSalary: $125,000.00 /year"
"Digital Marketing Business Strategist","Confidential - Marketing agency","Bellevue, WA","Description Looking for an experienced Integrated Business Marketing Strategist to join our growing agency. You will have experience architecting digital marketing plans that utilize the right tools at the right time, you integrate paid earned and owned and you enjoy building content marketing ecosystems that deliver the right content at the right time to the right people in order to achieve client goals. You possess a rare blend of enterprise B2C business marketing experience that spans content strategy, marketing automation, organic search, paid media, social media, analytics, web strategy, customer engagement and you also have the gravitas to inspire clients and team members alike towards your strategic vision.Key Responsibilities: Client Work:Collaborate with Client Services and SMEs to guide the strategic direction of our integrated digital effortsCollaborate with clients and our internal delivery teams to build content marketing architecture, including messaging and positioning frameworks, buyer personas, and buyer journey content mapsDevelop and implement a cross-channel integrated digital strategy that translates business and marketing goals into meaningful content deliverablesDeep subject matter expertise in organic customer traffic flow and the use of digital tools like organic sources to influence organic traffic flowsProvide feedback to internal and external contributors to ensure that content aligns to strategy and quality standardsWork with client consultants and strategists on how to reach target audiences for content amplification/native and ensure content is optimized for search engines, sharing, and distribution across channels resulting in flow and yield experiences.Research B2C content marketing and tech news/trends and be prepared to apply that knowledge across all client engagementsProduce content audits and gap analyses in framework that translates to enterprise needsDevelop automation and nurture strategies including lead scoring, KPI, and content  * Lead meetings with senior leadership and our clients, ensuring cross functional alignment on strategiesStart with a data mindset so as to ensure we can demonstrate return for effortsInternal Work:Serve as a subject matter expert by maintaining a pulse on the latest issues, developments, and trends in Mobile B2C integrated digital and content marketing strategyContribute to the health and growth of the agency through special projects, internal advisory boards, committee participation, and community involvementQualifications and Requirements: 4-year degree required4+ years of integrated marketing experience; experience with B2C marketing preferred4+ business consulting with consumer, search, market and competitive data2+ years of experience building and managing content marketing strategy (agency, technology company, or major publication experience preferred)3+ years agency experience working with tech clientsStrong experience with content distribution and amplification, including a solid understanding of social & paid mediaMastery of marketing fundamentals including segmentation, positioning, and market analysisA solid, conceptual understanding of marketing automation systems (e.g. Marketo, Eloqua, Pardot)Experience in a fast-paced environment with strict deadlinesExperience in a client-facing role; must feel comfortable presenting to and engaging with clientsForward-thinking with a passion for content marketingJob Type: Full-time"
"Project Manager, Marketing","The SpectrumCare Group","Napa, CA","The SpectrumCare Group seeks a talented project manager to help us get things done in a quickly growing, multi-faceted healthcare organization based in Napa, California.The Project Manager (PM) position will support the sales and marketing activities of multiple business lines throughout the organization, and will report to the COO of the organization, with guidance and support from the off-site Strategic Marketing Advisor. First and foremost, the PM will see all assigned projects through to completion, on time, on track, and on budget. The ideal candidate will be curious, quick, have very strong project management and organizational skills, and be a strong critical thinker, researcher, and communicator of ideas.Responsibilities include:  Defining scope, developing project plans, leading kick-off and status meetings, and ensuring all necessary communication with managers and relevant team members takes place to ensure project completion and alignment with internal goals. Developing and managing external vendor (agency, consultant, contractor) relationships, preparing SOWs, creative briefs, feedback, etc.; acting as an internal partner to find information, and solicit feedback for vendors whenever needed. Managing budgets and timelines for multiple projects of various sizes and complexity, for multiple departments simultaneously.The types of projects the PM will lead include, but aren't limited to:  Digital marketing campaigns: running and measuring the success of ad campaigns on all digital channels (see below for experience requirements). Print marketing campaigns: organizing, executing, and measuring print campaigns including direct mail, print advertisement, and more. Website development: ensuring the completion of multiple new websites and major website updates per year for new business lines and department needs. Development of new marketing materials including print flyers, posters, postcards, pamphlets, powerpoint presentations, event collateral, etc. Market research and report preparation, at the request and direction of the Marketing Advisor.Projects will be assigned by managers of internal business lines and guided by the Marketing Advisor, and will often be informed by your insights and research as requested. While you will have the support of the managers and the entire organization, we are looking for someone who can independently source the information they need to complete a project, research and read up on new subjects, ideas, and opportunities themselves, compile proofs and solicit feedback from others as needed, find, contract, and manage outside vendors, find creative solutions to roadblocks and hurdles, and push our entire team of busy professionals toward deadlines  often, many different deadlines at a time.About The SpectrumCare GroupThe SpectrumCare Group is health care organization based in the north Bay Area, specializing in the treatment of chronic conditions. We have busy two clinics, in two states, and are opening two more this year. We have an education business which designs a series of continuing medical education conferences that attract physicians from around the world, and a clinical research business that partners with national and international industry leaders to manage clinical trials here in the Bay Area. From the little town of Napa, we help drive some of the most important advances in our field  the people who succeed here are extremely curious, driven, and are excited that their work helps impact many thousands of lives.While our organization is 25 years old, we are in a new and exponential state of growth, and have an increasingly complex and multi-faceted business structure  we are opening new clinics, expanding our clinical research program, taking on new partnerships, designing new medical education conferences, and more. This means that our internal resources (especially time!) are often stretched very thin, so you'll need to help keep other busy managers and employees on track, and on time, to help fulfill all of our marketing needs, and support all of our shared goals. You'll be persistent, but pleasant, and help your colleagues find ways that work for them to keep your projects moving forward. There is ample room for growth here, and we welcome new ideas, insights, and suggestions always.Competency in the following will be helpful: MailChimp (managing campaigns, lists, and monitoring engagement metrics)WordPress (making small updates, troubleshooting, communicating with website developers)Facebook (business pages, ads, sponsored posts, engagement metrics)LinkedIn (business pages, ads, sponsored posts, engagement metrics)Adobe Suite (InDesign, Adobe Illustrator, for very small edits and updates if needed)*SalesForce (not required, but a bonus)Job Location: North Bay Area, CA (Napa)Required education: Bachelor'sRequired experience: Project Management: 3-5 yearsMarketing/Communications: 2-5 yearsHealth Care Familiarity a plus: 1-3 yearsTO APPLY:  please respond to this posting with a one-page cover letter, describing your experience managing a complex set of programs or projects, and interest in the role, and a resume including salary history.Learn more about The SpectrumCare Group and our related businesses at spectrumcaregroup.comJob Type: Full-timeRequired education:Bachelor'sRequired experience:Project Management: 3 years"
